{
  "schemaVersion": "0.4.0",
  "manifestId": "retrieval-manifest:continuation_fixture_review",
  "state": "frozen",
  "protocolBundle": {
    "id": "protocol:elad_0.4.0",
    "path": "blueprint.json",
    "sha256": "34B0279DA8BE529C30B9FD927513A120553DB6AEE09255634605F3CE86ABDC90",
    "schemaVersion": "0.4.0"
  },
  "subject": {
    "repositoryId": "repo:continuation_fixture",
    "baseRef": "synthetic-fixture",
    "baseHead": "ffffffffffffffffffffffffffffffffffffffff",
    "projectProfile": {
      "id": "project:continuation_fixture",
      "path": "tests/fixtures/continuation-valid/project-profile.json",
      "sha256": "4CA30577B439DDE9E5B8945CBCAE71C2E61C05BC5ADAC525489BDB238DF4C0A4",
      "schemaVersion": "0.4.0"
    },
    "authority": {
      "id": "authority:continuation_fixture",
      "path": "tests/fixtures/continuation-valid/authority.json",
      "sha256": "4B79D75BBE31687DD2A13BC85B33D4D6A334EECC9D7DB72698F50DBE560BB578",
      "schemaVersion": "0.4.0"
    }
  },
  "framing": "elad-canonical-json-outer-sha256-v1",
  "entries": [
    {
      "repositoryId": "repo:continuation_fixture",
      "path": "tests/fixtures/continuation-valid/retrieval/subject.txt",
      "bytes": 136,
      "sha256": "2153CD946EC5547A825EF7BE28302D3D384A6A32A58D21F24A61949585E2C640",
      "role": "frozen_review_subject",
      "slice": null,
      "freshness": "current_at_base",
      "workerAccess": "prebundled"
    }
  ],
  "createdAt": "2026-08-22T12:01:00Z",
  "supersedes": null
}
